{
  "classificationResultId": "exampleco-minimal-bundle-2026-03-24-classification",
  "generatedAt": "2026-03-24T00:05:00Z",
  "bundleId": "exampleco-minimal-bundle-2026-03-24",
  "verifierVersion": "opencompliance-verifier/0.9.2",
  "organisation": "ExampleCo",
  "profileId": "minimal_saas_corridor",
  "routeSummary": {
    "decidable": 2,
    "attestation": 2,
    "judgment": 1
  },
  "items": [
    {
      "claimId": "EX-CLAIM-001",
      "title": "Administrative identities require MFA in the scoped production environment.",
      "route": "decidable",
      "controlRefs": [
        "oc.id-01"
      ],
      "expectedClaimType": "identity_mfa_enforcement",
      "evidenceRequired": true,
      "leanBacked": true,
      "rationale": "Deterministic machine state over a narrow access-control predicate."
    },
    {
      "claimId": "EX-CLAIM-002",
      "title": "Audit logging is enabled for the scoped production stack.",
      "route": "decidable",
      "controlRefs": [
        "oc.log-01"
      ],
      "expectedClaimType": "audit_logging_state",
      "evidenceRequired": true,
      "leanBacked": true,
      "rationale": "Deterministic machine state over a narrow logging predicate."
    },
    {
      "claimId": "EX-CLAIM-003",
      "title": "Security awareness training completion is documented for the current review window.",
      "route": "attestation",
      "controlRefs": [
        "oc.train-01"
      ],
      "expectedClaimType": "training_attestation",
      "evidenceRequired": true,
      "leanBacked": false,
      "rationale": "Documentary evidence with a human attestor rather than a decidable system invariant."
    },
    {
      "claimId": "EX-CLAIM-004",
      "title": "The overall policy suite is adequate for the whole framework boundary.",
      "route": "judgment",
      "controlRefs": [],
      "expectedClaimType": null,
      "evidenceRequired": false,
      "leanBacked": false,
      "rationale": "Whole-program adequacy stays outside the machine-proof corridor."
    },
    {
      "claimId": "EX-CLAIM-005",
      "title": "Restore testing has been performed in the last quarter.",
      "route": "attestation",
      "controlRefs": [
        "oc.rec-01"
      ],
      "expectedClaimType": "restore_test_attestation",
      "evidenceRequired": true,
      "leanBacked": false,
      "rationale": "Recovery evidence is attestation-routed in the current corridor."
    }
  ],
  "note": "Synthetic persisted routing artifact for the OpenCompliance prove/attest/judgment split."
}
