{
  "classificationResultId": "exampleco-stale-bundle-2026-03-24-classification",
  "generatedAt": "2026-03-24T05:20:00Z",
  "bundleId": "exampleco-stale-bundle-2026-03-24",
  "verifierVersion": "opencompliance-verifier/0.9.0",
  "organisation": "ExampleCo",
  "profileId": "stale_freshness_corridor",
  "routeSummary": {
    "decidable": 2,
    "attestation": 2,
    "judgment": 0
  },
  "items": [
    {
      "claimId": "EX-CLAIM-401",
      "title": "Administrative identities require MFA in the scoped production environment.",
      "route": "decidable",
      "controlRefs": [
        "oc.id-01"
      ],
      "expectedClaimType": "identity_mfa_enforcement",
      "evidenceRequired": true,
      "leanBacked": true,
      "rationale": "Deterministic machine state over a narrow access-control predicate."
    },
    {
      "claimId": "EX-CLAIM-402",
      "title": "Audit logging is enabled for the scoped production stack.",
      "route": "decidable",
      "controlRefs": [
        "oc.log-01"
      ],
      "expectedClaimType": "audit_logging_state",
      "evidenceRequired": true,
      "leanBacked": true,
      "rationale": "Deterministic machine state over a narrow logging predicate, but only while the export is still fresh."
    },
    {
      "claimId": "EX-CLAIM-403",
      "title": "Security awareness training completion is documented for the current review window.",
      "route": "attestation",
      "controlRefs": [
        "oc.train-01"
      ],
      "expectedClaimType": "training_attestation",
      "evidenceRequired": true,
      "leanBacked": false,
      "rationale": "Documentary evidence with a human attestor remains valid only inside its declared freshness window."
    },
    {
      "claimId": "EX-CLAIM-404",
      "title": "Restore testing has been performed in the declared review window.",
      "route": "attestation",
      "controlRefs": [
        "oc.rec-01"
      ],
      "expectedClaimType": "restore_test_attestation",
      "evidenceRequired": true,
      "leanBacked": false,
      "rationale": "Recovery evidence is attestation-routed in the current corridor."
    }
  ],
  "note": "Synthetic persisted routing artifact for the OpenCompliance prove/attest/judgment split."
}
