{
  "classificationResultId": "exampleco-ai-governance-bundle-2026-03-24-classification",
  "generatedAt": "2026-03-24T06:40:00Z",
  "bundleId": "exampleco-ai-governance-bundle-2026-03-24",
  "verifierVersion": "opencompliance-example/0.7.0",
  "organisation": "ExampleCo",
  "profileId": "ai_governance_corridor",
  "routeSummary": {
    "decidable": 1,
    "attestation": 4,
    "judgment": 0
  },
  "items": [
    {
      "claimId": "EX-CLAIM-701",
      "title": "AI system intended use, deployment context, and named owner are documented for the current review window.",
      "route": "attestation",
      "controlRefs": [
        "oc.ai-01"
      ],
      "expectedClaimType": "ai_context_attestation",
      "evidenceRequired": true,
      "leanBacked": false,
      "rationale": "Documentary governance evidence with a named human attestor rather than a decidable runtime invariant."
    },
    {
      "claimId": "EX-CLAIM-702",
      "title": "AI risk management process and risk tolerances are documented for the current review window.",
      "route": "attestation",
      "controlRefs": [
        "oc.ai-02"
      ],
      "expectedClaimType": "ai_risk_management_attestation",
      "evidenceRequired": true,
      "leanBacked": false,
      "rationale": "Documentary governance evidence for the current AI risk process remains attestation-routed."
    },
    {
      "claimId": "EX-CLAIM-703",
      "title": "Human oversight roles, escalation path, and override responsibility are documented for the current review window.",
      "route": "attestation",
      "controlRefs": [
        "oc.ai-03"
      ],
      "expectedClaimType": "ai_human_oversight_attestation",
      "evidenceRequired": true,
      "leanBacked": false,
      "rationale": "Human oversight remains documentary governance evidence in the current corridor."
    },
    {
      "claimId": "EX-CLAIM-704",
      "title": "Post-deployment monitoring ownership and incident escalation are documented for the current review window.",
      "route": "attestation",
      "controlRefs": [
        "oc.ai-04"
      ],
      "expectedClaimType": "ai_monitoring_attestation",
      "evidenceRequired": true,
      "leanBacked": false,
      "rationale": "Post-deployment monitoring governance remains documentary in the current public corridor."
    },
    {
      "claimId": "EX-CLAIM-705",
      "title": "AI-generated content disclosure is enabled and enforcement checks are passing on the public assistant surface.",
      "route": "decidable",
      "controlRefs": [
        "oc.ai-05"
      ],
      "expectedClaimType": "ai_content_labeling_state",
      "evidenceRequired": true,
      "leanBacked": false,
      "rationale": "Deterministic disclosure configuration over a narrow transparency predicate."
    }
  ],
  "note": "Synthetic persisted routing artifact for the OpenCompliance prove/attest/judgment split."
}
