{
  "classificationResultId": "exampleco-issued-bundle-2026-03-24-classification",
  "generatedAt": "2026-03-24T02:10:00Z",
  "bundleId": "exampleco-issued-bundle-2026-03-24",
  "verifierVersion": "opencompliance-verifier/0.9.9",
  "organisation": "ExampleCo",
  "profileId": "issued_narrow_corridor",
  "routeSummary": {
    "decidable": 9,
    "attestation": 5,
    "judgment": 0
  },
  "items": [
    {
      "claimId": "EX-CLAIM-201",
      "title": "Administrative identities require MFA in the scoped production environment.",
      "route": "decidable",
      "controlRefs": [
        "oc.id-01"
      ],
      "expectedClaimType": "identity_mfa_enforcement",
      "evidenceRequired": true,
      "leanBacked": true,
      "rationale": "Deterministic machine state over a narrow access-control predicate."
    },
    {
      "claimId": "EX-CLAIM-209",
      "title": "Infrastructure access in the scoped production environment requires unique named identities with no shared administrative accounts.",
      "route": "decidable",
      "controlRefs": [
        "oc.id-04"
      ],
      "expectedClaimType": "infrastructure_auth_uniqueness_state",
      "evidenceRequired": true,
      "leanBacked": true,
      "rationale": "Deterministic identity-state evidence over a narrow unique-authentication predicate."
    },
    {
      "claimId": "EX-CLAIM-210",
      "title": "Scoped customer and environment boundaries are enforced with no undeclared cross-environment paths in the production slice.",
      "route": "decidable",
      "controlRefs": [
        "oc.seg-01"
      ],
      "expectedClaimType": "environment_segmentation_state",
      "evidenceRequired": true,
      "leanBacked": true,
      "rationale": "Deterministic architecture-state evidence over a narrow tenant and environment segmentation predicate."
    },
    {
      "claimId": "EX-CLAIM-211",
      "title": "Scoped password-quality controls enforce strong minimum length, no maximum-length restriction, and common-password blocking.",
      "route": "decidable",
      "controlRefs": [
        "oc.id-05"
      ],
      "expectedClaimType": "password_policy_state",
      "evidenceRequired": true,
      "leanBacked": true,
      "rationale": "Deterministic identity-policy evidence over a narrow password-quality predicate."
    },
    {
      "claimId": "EX-CLAIM-212",
      "title": "A managed web application firewall is attached to the scoped public ingress path, runs in blocking mode, and has a managed rule set active.",
      "route": "decidable",
      "controlRefs": [
        "oc.web-01"
      ],
      "expectedClaimType": "web_application_firewall_state",
      "evidenceRequired": true,
      "leanBacked": true,
      "rationale": "Deterministic perimeter-state evidence over a narrow managed-WAF predicate."
    },
    {
      "claimId": "EX-CLAIM-202",
      "title": "Audit logging is enabled for the scoped production stack.",
      "route": "decidable",
      "controlRefs": [
        "oc.log-01"
      ],
      "expectedClaimType": "audit_logging_state",
      "evidenceRequired": true,
      "leanBacked": true,
      "rationale": "Deterministic machine state over a narrow logging predicate."
    },
    {
      "claimId": "EX-CLAIM-213",
      "title": "Scoped runtime telemetry is forwarded to the declared central monitoring sink with detection rules enabled.",
      "route": "decidable",
      "controlRefs": [
        "oc.mon-01"
      ],
      "expectedClaimType": "central_monitoring_state",
      "evidenceRequired": true,
      "leanBacked": true,
      "rationale": "Deterministic telemetry-state evidence over a narrow centralized-monitoring predicate."
    },
    {
      "claimId": "EX-CLAIM-208",
      "title": "Encryption at rest is enabled for the scoped customer data stores and no unencrypted store is present.",
      "route": "decidable",
      "controlRefs": [
        "oc.crypt-01"
      ],
      "expectedClaimType": "encryption_at_rest_state",
      "evidenceRequired": true,
      "leanBacked": true,
      "rationale": "Deterministic storage-configuration state over a narrow encryption-at-rest predicate."
    },
    {
      "claimId": "EX-CLAIM-203",
      "title": "Security awareness training completion is documented for the current review window.",
      "route": "attestation",
      "controlRefs": [
        "oc.train-01"
      ],
      "expectedClaimType": "training_attestation",
      "evidenceRequired": true,
      "leanBacked": false,
      "rationale": "Documentary evidence with a human attestor rather than a decidable system invariant."
    },
    {
      "claimId": "EX-CLAIM-204",
      "title": "Restore testing has been performed in the declared review window.",
      "route": "attestation",
      "controlRefs": [
        "oc.rec-01"
      ],
      "expectedClaimType": "restore_test_attestation",
      "evidenceRequired": true,
      "leanBacked": false,
      "rationale": "Recovery evidence is attestation-routed in the current corridor."
    },
    {
      "claimId": "EX-CLAIM-205",
      "title": "A typed export of periodic access review evidence is present for the current review window.",
      "route": "decidable",
      "controlRefs": [
        "oc.id-02"
      ],
      "expectedClaimType": "access_review_export",
      "evidenceRequired": true,
      "leanBacked": true,
      "rationale": "Periodic access review can be machine-checked when a typed export exists for the scoped population and window."
    },
    {
      "claimId": "EX-CLAIM-206",
      "title": "Access review closure and high-risk exception resolution are attested for the current review window.",
      "route": "attestation",
      "controlRefs": [
        "oc.id-03"
      ],
      "expectedClaimType": "access_review_closure_attestation",
      "evidenceRequired": true,
      "leanBacked": false,
      "rationale": "Closure and exception signoff remain attestation-routed even when the review export itself is typed."
    },
    {
      "claimId": "EX-CLAIM-207",
      "title": "The incident response runbook is approved, owned, and current for the declared review window.",
      "route": "attestation",
      "controlRefs": [
        "oc.ir-01"
      ],
      "expectedClaimType": "incident_response_runbook_attestation",
      "evidenceRequired": true,
      "leanBacked": false,
      "rationale": "Incident runbook ownership and approval remain documentary facts in the current narrow issued corridor."
    },
    {
      "claimId": "EX-CLAIM-214",
      "title": "Monitoring review cadence, ownership, and retention operations are attested for the scoped production telemetry program.",
      "route": "attestation",
      "controlRefs": [
        "oc.mon-02"
      ],
      "expectedClaimType": "monitoring_review_attestation",
      "evidenceRequired": true,
      "leanBacked": false,
      "rationale": "Monitoring review operations remain documentary and owner-attested even when telemetry forwarding is machine-checkable."
    }
  ],
  "note": "Synthetic persisted routing artifact for the OpenCompliance prove/attest/judgment split."
}
