{
  "classificationResultId": "exampleco-cyber-baseline-bundle-2026-03-24-classification",
  "generatedAt": "2026-03-24T06:10:00Z",
  "bundleId": "exampleco-cyber-baseline-bundle-2026-03-24",
  "verifierVersion": "opencompliance-verifier/0.9.6",
  "organisation": "ExampleCo",
  "profileId": "cyber_baseline_corridor",
  "routeSummary": {
    "decidable": 5,
    "attestation": 0,
    "judgment": 0
  },
  "items": [
    {
      "claimId": "EX-CLAIM-601",
      "title": "Administrative identities require MFA and conditional access for the scoped managed admin boundary.",
      "route": "decidable",
      "controlRefs": [
        "oc.id-01"
      ],
      "expectedClaimType": "identity_mfa_enforcement",
      "evidenceRequired": true,
      "leanBacked": true,
      "rationale": "Deterministic identity policy state over a narrow access-control predicate."
    },
    {
      "claimId": "EX-CLAIM-602",
      "title": "The inbound network boundary defaults to deny and exposes only declared ingress ports.",
      "route": "decidable",
      "controlRefs": [
        "oc.boundary-01"
      ],
      "expectedClaimType": "network_firewall_boundary",
      "evidenceRequired": true,
      "leanBacked": true,
      "rationale": "Deterministic firewall and ingress policy state over a narrow boundary predicate."
    },
    {
      "claimId": "EX-CLAIM-603",
      "title": "Secure baseline configuration is applied and insecure defaults are absent in the managed device set.",
      "route": "decidable",
      "controlRefs": [
        "oc.cfg-01"
      ],
      "expectedClaimType": "secure_configuration_state",
      "evidenceRequired": true,
      "leanBacked": true,
      "rationale": "Deterministic configuration state over a narrow hardening predicate."
    },
    {
      "claimId": "EX-CLAIM-604",
      "title": "Supported versions are in use and no critical security updates are overdue in the managed device set.",
      "route": "decidable",
      "controlRefs": [
        "oc.patch-01"
      ],
      "expectedClaimType": "security_update_state",
      "evidenceRequired": true,
      "leanBacked": true,
      "rationale": "Deterministic patch and support-window state over a narrow update-management predicate."
    },
    {
      "claimId": "EX-CLAIM-605",
      "title": "Malware protection is enabled, current, and tamper-protected on the managed device set.",
      "route": "decidable",
      "controlRefs": [
        "oc.malware-01"
      ],
      "expectedClaimType": "malware_protection_state",
      "evidenceRequired": true,
      "leanBacked": true,
      "rationale": "Deterministic endpoint protection state over a narrow malware-baseline predicate."
    }
  ],
  "note": "Synthetic persisted routing artifact for the OpenCompliance prove/attest/judgment split."
}
