{
  "classificationResultId": "exampleco-ai-governance-bundle-2026-03-24-classification",
  "generatedAt": "2026-03-24T06:40:00Z",
  "bundleId": "exampleco-ai-governance-bundle-2026-03-24",
  "verifierVersion": "opencompliance-verifier/0.9.9",
  "organisation": "ExampleCo",
  "profileId": "ai_governance_corridor",
  "routeSummary": {
    "decidable": 5,
    "attestation": 10,
    "judgment": 1
  },
  "items": [
    {
      "claimId": "EX-CLAIM-701",
      "title": "AI system intended use, deployment context, and named owner are documented for the current review window.",
      "route": "attestation",
      "controlRefs": [
        "oc.ai-01"
      ],
      "expectedClaimType": "ai_context_attestation",
      "evidenceRequired": true,
      "leanBacked": false,
      "rationale": "Documentary governance evidence with a named human attestor rather than a decidable runtime invariant."
    },
    {
      "claimId": "EX-CLAIM-702",
      "title": "AI risk management process and risk tolerances are documented for the current review window.",
      "route": "attestation",
      "controlRefs": [
        "oc.ai-02"
      ],
      "expectedClaimType": "ai_risk_management_attestation",
      "evidenceRequired": true,
      "leanBacked": false,
      "rationale": "Documentary governance evidence for the current AI risk process remains attestation-routed."
    },
    {
      "claimId": "EX-CLAIM-703",
      "title": "Human oversight roles, escalation path, and override responsibility are documented for the current review window.",
      "route": "attestation",
      "controlRefs": [
        "oc.ai-03"
      ],
      "expectedClaimType": "ai_human_oversight_attestation",
      "evidenceRequired": true,
      "leanBacked": false,
      "rationale": "Human oversight remains documentary governance evidence in the current corridor."
    },
    {
      "claimId": "EX-CLAIM-704",
      "title": "Post-deployment monitoring ownership and incident escalation are documented for the current review window.",
      "route": "attestation",
      "controlRefs": [
        "oc.ai-04"
      ],
      "expectedClaimType": "ai_monitoring_attestation",
      "evidenceRequired": true,
      "leanBacked": false,
      "rationale": "Post-deployment monitoring governance remains documentary in the current public corridor."
    },
    {
      "claimId": "EX-CLAIM-705",
      "title": "AI-generated content disclosure is enabled and enforcement checks are passing on the public assistant surface.",
      "route": "decidable",
      "controlRefs": [
        "oc.ai-05"
      ],
      "expectedClaimType": "ai_content_labeling_state",
      "evidenceRequired": true,
      "leanBacked": true,
      "rationale": "Deterministic disclosure configuration over a narrow transparency predicate."
    },
    {
      "claimId": "EX-CLAIM-706",
      "title": "AI-generated content provenance metadata is enabled and verification checks are passing on the public assistant surface.",
      "route": "decidable",
      "controlRefs": [
        "oc.ai-06"
      ],
      "expectedClaimType": "ai_content_provenance_state",
      "evidenceRequired": true,
      "leanBacked": true,
      "rationale": "Deterministic provenance-configuration state over a narrow transparency predicate."
    },
    {
      "claimId": "EX-CLAIM-707",
      "title": "AI evaluation scope, testing layers, and findings capture are documented for the current review window.",
      "route": "attestation",
      "controlRefs": [
        "oc.ai-07"
      ],
      "expectedClaimType": "ai_evaluation_attestation",
      "evidenceRequired": true,
      "leanBacked": false,
      "rationale": "Evaluation design and findings remain documentary governance evidence in the current public corridor."
    },
    {
      "claimId": "EX-CLAIM-708",
      "title": "AI data sources, quality criteria, and lineage stewardship are documented for the current review window.",
      "route": "attestation",
      "controlRefs": [
        "oc.ai-08"
      ],
      "expectedClaimType": "ai_data_quality_attestation",
      "evidenceRequired": true,
      "leanBacked": false,
      "rationale": "Data-quality and lineage governance stay documentary in the current public corridor."
    },
    {
      "claimId": "EX-CLAIM-709",
      "title": "The lawful-basis and purpose register is current for the scoped AI-assisted processing path.",
      "route": "attestation",
      "controlRefs": [
        "oc.privacy-03"
      ],
      "expectedClaimType": "lawful_basis_register_attestation",
      "evidenceRequired": true,
      "leanBacked": false,
      "rationale": "Lawful-basis governance remains documentary but should still be explicit for AI-assisted processing."
    },
    {
      "claimId": "EX-CLAIM-710",
      "title": "A current privacy or AI impact assessment exists for the scoped AI-assisted processing path.",
      "route": "attestation",
      "controlRefs": [
        "oc.privacy-05"
      ],
      "expectedClaimType": "privacy_impact_assessment_attestation",
      "evidenceRequired": true,
      "leanBacked": false,
      "rationale": "Impact-assessment evidence remains documentary governance evidence rather than proof."
    },
    {
      "claimId": "EX-CLAIM-711",
      "title": "High-impact human review triggers and a contest path are documented for the scoped AI-assisted decision path.",
      "route": "attestation",
      "controlRefs": [
        "oc.ai-09"
      ],
      "expectedClaimType": "ai_human_review_trigger_attestation",
      "evidenceRequired": true,
      "leanBacked": false,
      "rationale": "Human-review trigger evidence remains documentary governance evidence in the current AI corridor."
    },
    {
      "claimId": "EX-CLAIM-712",
      "title": "The legality and contestability of significant-effect automated decisions have been fully demonstrated for every in-scope use case.",
      "route": "judgment",
      "controlRefs": [
        "oc.ai-10"
      ],
      "expectedClaimType": null,
      "evidenceRequired": false,
      "leanBacked": false,
      "rationale": "The legality and sufficiency of high-impact automated-decision controls remain explicitly outside the machine-proof corridor."
    },
    {
      "claimId": "EX-CLAIM-713",
      "title": "A typed task envelope bounds purpose, tool classes, data classes, retention class, and human-review linkage for the scoped AI-assisted operation.",
      "route": "decidable",
      "controlRefs": [
        "oc.ai-11"
      ],
      "expectedClaimType": "ai_task_envelope_state",
      "evidenceRequired": true,
      "leanBacked": true,
      "rationale": "A narrow task envelope is machine-checkable when the scoped AI operation publishes a typed control-plane envelope rather than only prose."
    },
    {
      "claimId": "EX-CLAIM-714",
      "title": "A rights-ready run trace retains purpose, input classifications, output references, and human-review linkage for the scoped AI-assisted operation.",
      "route": "decidable",
      "controlRefs": [
        "oc.ai-12"
      ],
      "expectedClaimType": "ai_rights_ready_run_trace_state",
      "evidenceRequired": true,
      "leanBacked": true,
      "rationale": "A structured run trace can be checked mechanically when the AI surface emits a typed rights-ready trace artifact."
    },
    {
      "claimId": "EX-CLAIM-715",
      "title": "The AI supplier and transfer map is current for the scoped AI-assisted operation and names subprocessors plus transfer mechanism coverage.",
      "route": "attestation",
      "controlRefs": [
        "oc.ai-13"
      ],
      "expectedClaimType": "ai_supplier_transfer_attestation",
      "evidenceRequired": true,
      "leanBacked": false,
      "rationale": "Supplier and transfer governance remains documentary, but the corridor should still expose it explicitly rather than hiding it inside a generic vendor placeholder."
    },
    {
      "claimId": "EX-CLAIM-716",
      "title": "The privacy notice for the scoped AI-assisted surface is currently published, reachable, and linked to the active rights path.",
      "route": "decidable",
      "controlRefs": [
        "oc.privacy-06"
      ],
      "expectedClaimType": "privacy_notice_publication_state",
      "evidenceRequired": true,
      "leanBacked": true,
      "rationale": "Notice publication state is machine-checkable when the scoped public surface exports a typed snapshot of publication and reachability facts."
    }
  ],
  "note": "Synthetic persisted routing artifact for the OpenCompliance prove/attest/judgment split."
}
